{
    "invoicingConnection": {
        "iban": "CH88 0900 0000 3064 1768 2",
        "institute": "Postfinanz Schweiz",
        "bic": "POFICHBEXXX"
    },
    "dueDate": "2017-01-07",
    "paymentConditions": "30 days net",
    "invoiceDate": "2016-12-07",
    "invoicingEntity": {
        "vatNr": "CHE-357.875.339 MWST",
        "name": "tangly llc",
        "id": "CHE-357.875.339",
        "address": {
            "country": "CH",
            "street": "Lorzenhof 27",
            "locality": "Cham",
            "postCode": "6330",
            "region": "ZG"
        },
        "email": "info@tangly.net"
    },
    "invoicedEntity": {
        "name": "Lucerne School of Information Technology",
        "id": "CHE-302.967.535",
        "address": {
            "poBox": "Postfach",
            "country": "CH",
            "street": "Technikumstrasse 21",
            "locality": "Horw",
            "postCode": "6048",
            "region": "ZG",
            "extended": "z.H. John Doe"
        },
        "email": "finances@hslu.ch"
    },
    "name": "2017-8022-Invoice-HSLU-December",
    "contractId": "HSLU-2015",
    "currency": "CHF",
    "locale": "de",
    "id": "2017-8022",
    "text": "Vorlesung ENAPP Architektur 2017-12-07",
    "items": [
        {
            "article": {
                "unitPrice": "190",
                "unit": "hour",
                "description": "Agile training at recognized technical university",
                "id": "5002"
            },
            "quantity": "3",
            "position": 1,
            "vatRate": "0.0",
            "text": "Vorlesung Modul ENAPP Architecture\u201c - Kotr/Kost 110083-00"
        }
    ]
}
