{
    "invoicingConnection": {
        "iban": "CH88 0900 0000 3064 1768 2",
        "institute": "Postfinanz Schweiz",
        "bic": "POFICHBEXXX"
    },
    "dueDate": "2020-06-30",
    "paymentConditions": "30 days net",
    "invoiceDate": "2020-06-30",
    "invoicingEntity": {
        "vatNr": "CHE-357.875.339 MWST",
        "name": "tangly llc",
        "id": "CHE-357.875.339",
        "address": {
            "country": "CH",
            "street": "Lorzenhof 27",
            "locality": "Cham",
            "postCode": "6330",
            "region": "ZG"
        },
        "email": "info@tangly.net"
    },
    "invoicedEntity": {
        "name": "Lucerne School of Information Technology",
        "id": "CHE-302.967.535",
        "address": {
            "poBox": "Postfach",
            "country": "CH",
            "street": "Technikumstrasse 21",
            "locality": "Horw",
            "postCode": "6048",
            "region": "ZG",
            "extended": "z.H. John Doe"
        },
        "email": "finances@hslu.ch",
        "emailccs": [
            "john.doe@hslu.ch"
        ]
    },
    "name": "2020-8001-Invoice-HSLU-May",
    "contractId": "HSLU-2020",
    "currency": "CHF",
    "locale": "de",
    "id": "2020-8001",
    "text": "Vorlesung Software Architecture and Techniques SWAT 2020-02-22 bis 2020-05-31 basierend auf Vertragsbest√§tigung vom 05 Februar 2020",
    "items": [
        {
            "article": {
                "unitPrice": "190",
                "unit": "hour",
                "description": "Agile training at recognized technical university",
                "id": "5002"
            },
            "quantity": "49",
            "vatRate": "0.0",
            "position": 1,
            "text": "Vorlesung Software Architecture and Techniques (Kost/Kotr 160\u2019000)"
        }
    ]
}
