{
    "invoicingConnection": {
        "iban": "CH88 0900 0000 3064 1768 2",
        "institute": "Postfinanz Schweiz",
        "bic": "POFICHBEXXX"
    },
    "dueDate": "2017-02-28",
    "paymentConditions": "30 days net",
    "invoiceDate": "2017-01-25",
    "invoicingEntity": {
        "vatNr": "CHE-357.875.339 MWST",
        "name": "tangly llc",
        "id": "CHE-357.875.339",
        "address": {
            "country": "CH",
            "street": "Lorzenhof 27",
            "locality": "Cham",
            "postCode": "6330",
            "region": "ZG"
        },
        "email": "info@tangly.net"
    },
    "invoicedEntity": {
        "name": "Lucerne School of Information Technology",
        "id": "CHE-302.967.535",
        "address": {
            "poBox": "Postfach",
            "country": "CH",
            "street": "Technikumstrasse 21",
            "locality": "Horw",
            "postCode": "6048",
            "region": "ZG",
            "extended": "z.H. John Doe"
        },
        "email": "finances@hslu.ch"
    },
    "name": "2017-8001-Invoice-HSLU-February",
    "contractId": "HSLU-2015",
    "currency": "CHF",
    "locale": "de",
    "id": "2017-8001",
    "text": "Kurzeinsatz in der Weiterbildung 2016-10-15",
    "items": [
        {
            "article": {
                "unitPrice": "200",
                "unit": "hour",
                "description": "Agile training at recognized technical university",
                "id": "5003"
            },
            "quantity": "1",
            "vatRate": "0.0",
            "position": 1,
            "text": "Pauschalentschädigung für Expertinnen und Experten (mündliche Modulendprüfung inkl. Spesen)"
        },
        {
            "article": {
                "unitPrice": "25",
                "unit": "unit",
                "description": "Examination work per student",
                "id": "5004"
            },
            "quantity": "20",
            "vatRate": "0.0",
            "position": 2,
            "text": "Studenten mündliche Prüfung"
        },
        {
            "position": 3,
            "text": "Test subtotal",
            "items": [
                1,
                2
            ]
        }
    ]
}
